[
  {
    "evaluation_run_id": "169bea0d-608d-4076-abbe-350c416f64c6",
    "component": "clinical_extraction:claude-sonnet-5",
    "candidate_version": "claude-sonnet-5/extraction-fr-4",
    "dataset_version": "oris-synthetic-corpus@1.0",
    "metrics": {
      "cases": 100.0,
      "reliability": 0.94,
      "fact_precision": 0.42415316642120765,
      "fact_recall": 0.5061511423550088,
      "duplicate_fact_rate": 0.023564064801178203,
      "negation_accuracy": 0.9861111111111112,
      "temporality_accuracy": 0.9826388888888888,
      "status_accuracy": 0.9548611111111112,
      "plan_vs_performed_accuracy": 0.9424083769633508,
      "unknown_teeth": 0.0,
      "renderable_fact_rate": 0.9734904270986745,
      "resolver_rejection_rate": 0.0,
      "schema_valid_first_try": 1.0,
      "latency_p50_s": 10.256179582967889,
      "latency_p95_s": 28.371619625017047,
      "input_tokens_mean": 6275.382978723404,
      "output_tokens_mean": 1944.723404255319,
      "cost_usd_per_consultation": 0.031998
    },
    "critical_regressions": [
      "ORIS-SYN-003:rejected:EXTRACTION_INVALID_OUTPUT",
      "ORIS-SYN-017:rejected:EXTRACTION_INVALID_OUTPUT",
      "ORIS-SYN-018:rejected:EXTRACTION_INVALID_OUTPUT",
      "ORIS-SYN-020:rejected:EXTRACTION_INVALID_OUTPUT",
      "ORIS-SYN-024:negation_lost",
      "ORIS-SYN-026:rejected:EXTRACTION_INVALID_OUTPUT",
      "ORIS-SYN-032:negation_lost",
      "ORIS-SYN-095:rejected:EXTRACTION_INVALID_OUTPUT",
      "ORIS-SYN-096:negation_lost",
      "ORIS-SYN-097:negation_lost"
    ],
    "created_at": "2026-09-17T23:29:14.501513+00:00",
    "release_gate_passed": false
  },
  {
    "evaluation_run_id": "617247bb-250e-4685-b658-c443e536bae7",
    "component": "clinical_extraction:claude-haiku-4-5-20251001",
    "candidate_version": "claude-haiku-4-5-20251001/extraction-fr-4",
    "dataset_version": "oris-synthetic-corpus@1.0",
    "metrics": {
      "cases": 100.0,
      "reliability": 0.69,
      "fact_precision": 0.42417582417582417,
      "fact_recall": 0.4606205250596659,
      "duplicate_fact_rate": 0.02857142857142857,
      "negation_accuracy": 0.9948186528497409,
      "temporality_accuracy": 0.9015544041450777,
      "status_accuracy": 0.9119170984455959,
      "plan_vs_performed_accuracy": 0.9312977099236641,
      "unknown_teeth": 1.0,
      "renderable_fact_rate": 0.9824175824175824,
      "resolver_rejection_rate": 0.0,
      "schema_valid_first_try": 1.0,
      "latency_p50_s": 8.972340791020542,
      "latency_p95_s": 16.94931950001046,
      "input_tokens_mean": 6497.811594202899,
      "output_tokens_mean": 1747.7246376811595,
      "cost_usd_per_consultation": 0.015236434782608697
    },
    "critical_regressions": [
      "ORIS-SYN-002:rejected:EXTRACTION_INVALID_OUTPUT",
      "ORIS-SYN-004:rejected:EXTRACTION_INVALID_OUTPUT",
      "ORIS-SYN-008:rejected:EXTRACTION_INVALID_OUTPUT",
      "ORIS-SYN-010:rejected:EXTRACTION_INVALID_OUTPUT",
      "ORIS-SYN-012:rejected:ANTHROPIC_NETWORK",
      "ORIS-SYN-013:rejected:ANTHROPIC_NETWORK",
      "ORIS-SYN-014:rejected:ANTHROPIC_NETWORK",
      "ORIS-SYN-015:rejected:ANTHROPIC_NETWORK",
      "ORIS-SYN-016:rejected:ANTHROPIC_NETWORK",
      "ORIS-SYN-017:rejected:ANTHROPIC_NETWORK",
      "ORIS-SYN-018:rejected:ANTHROPIC_NETWORK",
      "ORIS-SYN-019:rejected:ANTHROPIC_NETWORK",
      "ORIS-SYN-020:rejected:ANTHROPIC_NETWORK",
      "ORIS-SYN-022:rejected:EXTRACTION_INVALID_OUTPUT",
      "ORIS-SYN-024:unknown_teeth",
      "ORIS-SYN-028:rejected:EXTRACTION_INVALID_OUTPUT",
      "ORIS-SYN-032:rejected:EXTRACTION_INVALID_OUTPUT",
      "ORIS-SYN-038:rejected:EXTRACTION_INVALID_OUTPUT",
      "ORIS-SYN-039:rejected:EXTRACTION_INVALID_OUTPUT",
      "ORIS-SYN-065:rejected:EXTRACTION_INVALID_OUTPUT",
      "ORIS-SYN-073:rejected:EXTRACTION_INVALID_OUTPUT",
      "ORIS-SYN-075:rejected:EXTRACTION_INVALID_OUTPUT",
      "ORIS-SYN-076:rejected:EXTRACTION_INVALID_OUTPUT",
      "ORIS-SYN-077:rejected:EXTRACTION_INVALID_OUTPUT",
      "ORIS-SYN-078:rejected:EXTRACTION_INVALID_OUTPUT",
      "ORIS-SYN-079:rejected:EXTRACTION_INVALID_OUTPUT",
      "ORIS-SYN-081:rejected:EXTRACTION_INVALID_OUTPUT",
      "ORIS-SYN-082:rejected:EXTRACTION_INVALID_OUTPUT",
      "ORIS-SYN-085:rejected:EXTRACTION_INVALID_OUTPUT",
      "ORIS-SYN-086:rejected:EXTRACTION_INVALID_OUTPUT",
      "ORIS-SYN-090:rejected:EXTRACTION_INVALID_OUTPUT",
      "ORIS-SYN-096:rejected:EXTRACTION_INVALID_OUTPUT",
      "ORIS-SYN-097:negation_lost"
    ],
    "created_at": "2026-09-18T06:28:04.061214+00:00",
    "release_gate_passed": false
  }
]